Headline,Content,Image,Url
‘Dharam ji will be given tribute’: Hema Malini talks about late husband Dharmendra being honoured at Delhi event,"Actor-politician Hema Malini has said that her late husband, Dharmendra , will be given tribute at Delhi's first International Film Festival Delhi (IFFD) 2026. Speaking to ANI, ahead of the inauguration of the festival in the national capital, Hema Malini said that she will receive the award. The event begins in Delhi on Wednesday. Hema Malini and Dharmendra were married for many decades before his death. Dharmendra to be honoured at Delhi's film festival Hema said, ""I would like to congratulate Rekha Gupta ji for organising the International Film Festival in Delhi. It is going to be there for 4-5 days. She has also invited many artists. Many artists will be honoured at the festival. They are also paying tribute to Dharam ji... So, I will be there to receive it."" Which celebs will attend International Film Festival Delhi The festival will kick off on Wednesday evening at Bharat Mandapam, with a grand opening ceremony hosted by Arjun Kapoor and Nimrat Kaur. The evening will feature appearances by Vicky Kaushal, Sanya Malhotra, Siddhant Chaturvedi, Anupam Kher, and Lauren Gottlieb, setting the tone for a week defined by strong talent presence and cross-industry exchange. The week-long festival will run from March 25-31. It will offer a series of screenings, discussions, and industry events across various venues in New Delhi, uniting filmmakers, industry professionals, and audiences from around the globe. Recently, when Dharmendra was not mentioned in the In Memoriam segment at ",['https://www.hindustantimes.com/ht-img/img/2026/03/25/400x225/Hema_Malini_1774445592274_1774445592671.jpg'],https://www.hindustantimes.com/entertainment/bollywood/hema-malini-says-dharmendra-will-be-given-tribute-at-international-film-festival-delhi-101774444474483.html
A flawed and regressive bill,"The Transgender Persons (Protection of Rights) Amendment Bill 2026 pushes us to return to the first principles of citizenship. What is gender? And, what is the value of a citizen’s assertion in claiming their gender? If there is anything to learn from our own ground reality, it is that plurality and not binariness lies at the heart of gender identity, gender expression, and sex characteristics. (Sanjeev Verma/HT Photo) The State seems to have a clear idea of gender, as this bill suggests: It has defined transgender as a complex of four sociocultural identities and a set of congenital variations in chromosomes, which are scientifically called intersex variations and differences in sexual development, and imagined it in a post-operative, medically authorised framework. Unfortunately, it leaves out identities such as Thirunangai, Thirunambi from Tamil Nadu, Shivashaktis from Telangana, Andhra Pradesh, and Karnataka, traditionally accepted identities from parts of the Northeast, such as Nupa Manba and Nupi Manbi, Sumanglik communities in Manipur, trans masculine, agender and gender queer identities, among others. The bill also confuses intersex identities with transgender identities. While the former is an umbrella term for sex characteristics (internal or external), the latter is an assertion of an individual’s gender identity, which does not match their assigned gender at birth. To presume that specific sex characteristics map onto a transgender identity is a scientifically inc",['https://www.hindustantimes.com/ht-img/img/2026/03/25/400x225/If-there-is-anything-to-learn-from-our-own-ground-_1774452029250.jpg'],https://www.hindustantimes.com/editorials/a-flawed-and-regressive-bill-101774452041171.html
"KKR replace Harshit Rana with former RCB pacer, Gujarat Titans rope in Kulwant Khejroliya as replacement player","Kolkata Knight Riders have confirmed Navdeep Saini as the replacement for Harshit Rana , who will miss the entire IPL 2026 season following a recent knee injury. The right-arm pacer, formerly played for RCB and RR, joins KKR for INR 75 lakh. Saini has taken 23 wickets in 32 IPL matches so far and has also claimed 23 wickets in international cricket, bringing firepower to the KKR bowling attack. His inclusion aims to bolster the pace department and provide a steady option for the franchise, as they have suffered an injury crisis in the camp. Kulwant Khejroliya has been signed for INR 30 lakh. (X Image) Meanwhile, Harshit had established himself as a vital part of KKR’s pace attack, contributing significantly to their 2024 title-winning campaign with 19 wickets. The franchise backed him by retaining him for INR 4 crore last season, and he continued his strong form, adding 15 more wickets while representing KKR, cementing his role as a key strike bowler. On being named KKR’s replacement for Harshit, Saini called it a moment of personal revival, saying he was overwhelmed by the news and highlighting the hard work and persistence that have carried him through the ups and downs of the past few years. “When I came to know about it last night, I didn’t know how to react. I have been working hard and manifested it. It’s a revival for me as I have gone through ups and downs in the last two-three years,” said Saini. Earlier, KKR roped in left-arm pacer Saurabh Dubey as a replacement for",['https://www.hindustantimes.com/ht-img/img/2026/03/25/400x225/Kulwant_Khejroliya_1774453708194_1774453714548.jpg'],https://www.hindustantimes.com/cricket/kkr-replace-harshit-rana-with-former-rcb-pacer-gujarat-titans-rope-in-kulwant-khejroliya-as-replacement-player-101774453230337.html
---,---,---,---
"Gujarat Titans IPL 2026 full schedule: List of GT fixtures with match dates, venues and timings","Gujarat Titans had strong IPL 2025 campaign, finishing in third position during the league phase. But then a defeat to Mumbai Indians in the play-offs ended their dreams of reaching a third IPL final. GT won the IPL title in their debut season in 2022, and then they lost to Chennai Super Kings in the 2023 final. During the league phase last year, GT won nine matches and lost five. Gujarat Titans' captain Shubman Gill and Sai Sudharsan will be key in IPL 2026. (Rahul Singh) Led by Shubman Gill, GT will be aiming to put in a dominant show this season too, and open their IPL 2026 campaign against Punjab Kings on March 31 in New Chandigarh. Then they face Rajasthan Royals in their first home game of the season on April 4 in Ahmedabad. Also Read: BCCI set to honour Rahul Dravid for his contribution to Indian cricket GT also decided to retain 20 players and entered the mini-auction with a purse of ₹ 12.90 crore. They spent big on West Indies all-rounder Jason Holder, acquiring him for ₹ 7 crore. Meanwhile, they purchased Tom Banton for ₹ 2 crore. Ashok Sharma, Luke Wood and Prithviraj Yarra were roped in for ₹ 90 lakh, ₹ 75 lakh and ₹ 30 lakh. They let Sherfane Rutherford move to MI on the retention deadline. Before Rutherford, they let go Gerald Coetzee and Dasun Shanaka. Meanwhile, Karim Jannat, Mahipal Lomror and Kulwant Khejroliya were also released. For the new season, the BCCI released fixtures for the first phase of the tournament. The remaining fixtures will be announced in",['https://www.hindustantimes.com/ht-img/img/2026/03/12/400x225/ANI-20250518292-0_1748157105010_1773300235314.jpg'],https://www.hindustantimes.com/cricket/gujarat-titans-ipl-2026-full-schedule-bcci-indian-premier-league-match-time-table-fixtures-venue-timings-101773300138678.html
---,---,---,---
---,---,---,---
"Dhurandhar 2 box office collection day 7 (updated live): Ranveer Singh film races past  ₹600 cr, beats Chhaava lifetime","Dhurandhar 2 box office collection day 7: Dhurandhar The Revenge is finally slowing down at the box office after a manic opening weekend and two strong days, including the biggest Monday in Indian cinema history. Yet, the momentum it carries is so strong that despite this ‘slowdown’, Dhurandhar 2’s first Wednesday is tracking better than most films’ opening days. Dhurandhar 2 box office collection day 7: Ranveer Singh with Mustafa in a still from the film. Dhurandhar 2 Wednesday box office collection (till 9 PM) The Ranveer Singh spy thriller had a mega opening on Thursday, following record-breaking collections from paid previews. The film saw three ₹ 100+ crore days in its four-day opening weekend, minting ₹ 454 crore net domestically. On Monday, the film saw a drop of just 43%, adding a strong ₹ 65 crore net to the figure. This was followed by ₹ 56 crore net collections on Tuesday, taking the film’s domestic haul to ₹ 575 crore net. On Wednesday, its 7th day in theatres, the action thriller again started on a strong note, even as the morning shows saw its lowest footfall ever. According to Sacnilk, Dhurandhar 2 registered around 20% occupancy across morning shows on Wednesday. This helped the film earn ₹ 39.75 crore net by 9 PM, taking its total domestic haul to ₹ 615.47 crore net in under seven days. Dhurandhar 2 races to ₹ 600 crore On Tuesday, Dhurandhar 2 outgrossed Sunny Deol’s Gadar 2, Shah Rukh Khan’s Pathaan, and Ranbir Kapoor’s Animal. That it surpassed the lifetim",['https://www.hindustantimes.com/ht-img/img/2026/03/25/400x225/Dhurandhar_2_box_office_1774422478745_1774422478868.jpg'],https://www.hindustantimes.com/entertainment/bollywood/dhurandhar-2-box-office-collection-day-7-ranveer-singh-aditya-dhar-film-600-crore-stree-2-chhaava-bollywood-101774422270371.html
"Yograj Singh’s fiery rant at Abhishek Sharma, claims he’s ‘disgusted’: ‘Would take another age to get close to Yuvraj’","Former India cricketer Yograj Singh took aim at Abhishek Sharma after a stop-start T20 World Cup campaign that never quite lived up to expectations. Tipped by many as a potential match-winner and even a top run-scorer, the left-hander began on a disastrous note with three successive ducks, setting the tone for a difficult tournament. Abhishek Sharma had a mixed T20 World Cup. (AFP) He eventually finished with 141 runs from eight matches at an average of 17.62. There were glimpses of his ability, including a crucial half-century in the final, but consistency eluded him. Abhishek struggled to stitch together meaningful contributions, often getting stuck against spin. His discomfort, particularly against off-spin, was evident throughout the competition. Yograj didn’t hold back while assessing Abhishek's struggles, questioning his focus and work ethic, and pointing to distractions off the field as a key reason behind the youngster’s dip in form. ""You fail because your mind is somewhere else. What is happening to Shubman Gill, Abhishek? The failure comes only when your mind is diverted somewhere else. That is what is happening with Abhishek. The guy walks around doing reels, that isn’t his job. He should bloody well go to bed at 9 PM, wake up at 5 PM, and play a thousand balls,"" Yograj said on InsideSport. Abhishek had earlier spent time under the guidance of Yuvraj Singh , who played a key role in shaping his game before he broke into the Indian side. Also Read - Yograj Singh fir",['https://www.hindustantimes.com/ht-img/img/2026/03/25/400x225/Abhishek_Sharma_1774445897324_1774445897499.jpg'],https://www.hindustantimes.com/cricket/yograj-singh-s-fiery-rant-at-abhishek-sharma-claims-he-s-disgusted-would-take-another-age-to-get-close-to-yuvraj-101774445537970.html
Therapist reveals why mindless scrolling feels calm but zaps your energy,"The definition of relaxation has evolved over the years. From reading newspapers to books, from walking to chatting with friends, it has now turned into mindless scrolling through social media. Undoubtedly, scrolling may feel relaxing, but it often leaves us drained and fatigued, undermining the true purpose of relaxation. In a conversation with HT Lifestyle, Hema Mishra, therapist and relationship coach on Coto, an emotional wellness platform, revealed why scrolling can feel soothing in the moment but ultimately overwhelms our minds and disrupts our mental energy. Scrolling through social media can feel relaxing, but it often leaves you more tired than when you started. (Pexel) Also read | Anti socials: Why young people are quiet-quitting social media Why mindless scrolling feels calm Hema Mishra said, “Scrolling through social media can feel relaxing, but it often leaves you more tired than when you started. At first, it seems like a break, a way to unwind, but your brain is actually being constantly stimulated.” Psychologically, this happens because of variable rewards. Every like, comment, or new post triggers a small burst of dopamine , giving you a quick hit of pleasure. The unpredictability keeps you hooked, similar to how slot machines work, making it hard to stop. However, at the same time, endless scrolling creates cognitive overload. Your brain processes a flood of images, videos, and information, which can be mentally exhausting. Even though it feels like downtime","['https://images.hindustantimes.com/default/550x309.jpg', 'https://www.hindustantimes.com/ht-img/img/2026/03/25/400x225/pexels-photo-374637_1774441043004_1774441056093.jpeg']",https://www.hindustantimes.com/lifestyle/health/therapist-reveals-why-mindless-scrolling-feels-calm-but-zaps-your-energy-101774434617741.html
AIADMK's full list of candidates for Tamil Nadu assembly polls,"All India Anna Dravida Munnetra Kazhagam (AIADMK), which is part of the National Democratic Alliance (NDA) is all set to contest for the Tamil Nadu Assembly Elections, scheduled next month. Leader of Opposition in the Tamil Nadu Assembly and AIADMK chief Edappadi K Palaniswami greets supporters during an election roadshow at the Mylapore constituency, ahead of the state Assembly elections, in Chennai district. (PTI) On Wednesday, the party released the first list of 23 candidates for the polls, that include 21 former ministers. AIADMK has also finalised a seat-sharing formula with the partners, where 27 seats are assigned to the BJP, 18 to the Pattali Makkal Katchi (PMK) party, 11 to the Amma Makkal Munnetra Kazhagam (AMMK), and Tamil Maanila Congress getting 5 seats. AIADMK remains the largest party with the majority share of 178 seats. Also Read: Why is Kamal Haasan's MNM not contesting Tamil Nadu elections 2026 Party's General Secretary Edappadi K Palaniswami will be contesting from his home ground, Edappadi. Natham R Viswanathan will contest from Natham, K P Munusamy from Veppanahalli, S P Velumani from Thondamuthur, Dindigul C Srinivasan from Dindigul, and D Jayakumar from Royapuram. Here is a full list of AIADMK candidates for Tamil Nadu elections: AIADMK's full list of candidates Edappadi K. Palaniswami: Edappadi K.P. Munusamy: Veppanahalli Dindigul C. Sreenivasan: Dindigul Natham R. Viswanathan: Natham S.P. Velumani: Thondamuthur P. Thangamani: Kumarapalayam D. Jayaku",['https://www.hindustantimes.com/ht-img/img/2026/03/25/400x225/PTI03-25-2026-000368B-0_1774450647400_1774450680531.jpg'],https://www.hindustantimes.com/india-news/aiadmk-full-list-of-candidates-for-tamil-nadu-assembly-polls-101774450043664.html
---,---,---,---
Delhi’s anti-pollution steps miss the point,"For much of the last decade, Delhi has been defined by its air pollution crisis. In the last two years, the city recorded no “good” air day — not one with an AQI below 50. Delhi chief minister Rekha Gupta spent her first winter in office against this backdrop — the first time since 2014 that the Centre and the Capital were under the same party. The conditions for a breakthrough, many Delhi residents thought, were finally in place. Instead, the Gupta government’s first winter looked less like a departure than a continuation. The previous AAP government, for instance, portrayed the smog tower, which a government-commissioned IIT study found functionally useless, as one of its signature interventions. The Gupta government deployed misting poles and anti-smog guns along prestige corridors: Visible, photogenic, but scientifically cosmetic. Worse, the administration was accused of managing AQI measurements. The Gupta government deployed misting poles and anti-smog guns along prestige corridors: Visible, photogenic, but scientifically cosmetic. (PTI) On Tuesday, Gupta presented a budget she described as 21% “green” — ₹ 22,236 crore of a ₹ 1.03 lakh crore outlay going towards green causes. Some of it holds promise — the electric bus fleet and increased forestry spending should yield gains, if honoured. But the operational core signals no new thinking. The dedicated creceives ₹ 300 crore for mechanical sweepers, anti-smog guns, and water sprinklers — the same toolkit its predecessor r",['https://www.hindustantimes.com/ht-img/img/2026/03/25/400x225/The-Gupta-government-deployed-misting-poles-and-an_1774452028598.jpg'],https://www.hindustantimes.com/editorials/delhis-anti-pollution-steps-miss-the-point-101774452030798.html
"Woman quits KPMG Singapore job, becomes poet in Mumbai: 'I was too right-brained for corporate'","An Indian woman has opened up about quitting her corporate job in Singapore and moving back home to pursue poetry full-time. In a conversation with Business Insider, Namrata Yadav, a 28-year-old consultant-turned-writer, shared why she walked away from her role at KPMG Singapore to build a life centred around writing in Mumbai . Namrata Yadav is a 28-year-old consultant-turned-writer. (LinkedIn/Namrata Yadav) “I’ve always loved writing and being creative. But for my parents, the thought of me pursuing writing was absurd,” she told Business Insider, noting that creative careers are often not encouraged in many Indian households. Yadav, whose parents come from rural backgrounds, said that they prioritised stability and security while raising their children. Yadav shared that she spent nearly a decade studying and working across law, research, and consulting before realising corporate life wasn’t the right fit. “After 10 years in law school, research, and consulting, I decided I wanted a life I enjoyed rather than one spent living for the weekends. Last year, I quit my job at KPMG and moved from Singapore to Mumbai to be a full-time writer,” she said. Yadav added that after completing her law degree, she pursued a master’s in international relations at the National University of Singapore between 2019 and 2021, followed by a 6-month stint as a research analyst. In 2022, she then joined KPMG to explore consulting. “The work culture was decent, and I earned a stable annual salary ",['https://www.hindustantimes.com/ht-img/img/2026/03/25/400x225/Namrata_Yadav_1774432516219_1774432524218.jpg'],https://www.hindustantimes.com/trending/woman-quits-kpmg-singapore-job-becomes-poet-in-mumbai-i-was-too-right-brained-for-corporate-101774432161867.html
---,---,---,---
"Yograj Singh fires salvo at Ashwin, vows to prove Arjun Tendulkar critics wrong: 'He is talking bulls**t. Who are you?'","Former India cricketer Yograj Singh came down heavily on Ravichandran Ashwin over his remarks about Arjun Tendulkar ’s chances of making the Lucknow Super Giants XI this season. Ashwin had expressed doubts about Arjun finding a spot in the playing lineup, pointing to the strong competition within the squad. Yograj Singh fumes at Ravichandran Ashwin’s Arjun Tendulkar verdict (X and PTI) Arjun, who earlier featured for Mumbai Indians , joined LSG in a trade ahead of IPL 2026 and has been working hard to prove himself in a new environment. However, breaking into the side won’t be easy. The franchise already has an impressive pool of Indian pacers, including Mayank Yadav, Mohsin Khan, Avesh Khan and Mohammed Shami. With such established names in the mix, Ashwin felt Arjun could struggle for opportunities. Yograj unleashed a no-holds-barred rant at Ashwin for questioning the youngster’s place in the XI. Clearly irked by the remark, the former India cricketer didn’t hold back, tearing into Ashwin’s criticism and challenging his authority to pass such judgments on a player still trying to find his footing. ""He is talking bulls**t, this guy, Ashwin, whoever he is. He should know what to talk about somebody. Somebody's sitting on the television and talking,' Oh, he can't do this, he can't do that'. Who are you? What are you?"" Yograj said on InsideSport. Also Read - RCB, Rajasthan Royals and valuation boom: How IPL’s latest sales pushed league into global sports asset elite Yograj cont",['https://www.hindustantimes.com/ht-img/img/2026/03/25/400x225/Yograj_Arjun_Ashwin_1774433984803_1774433991701.jpg'],https://www.hindustantimes.com/cricket/yograj-singh-fires-salvo-at-ashwin-vows-to-prove-arjun-tendulkar-critics-wrong-he-is-talking-bulls-t-who-are-you-101774433259512.html
"Bengaluru couple spends  ₹15,000 a month on pet dog, sparks discussion on ‘DINKWAD’ trend","A Bengaluru -based couple’s spending habits for their pet dog have sparked a discussion online after a startup founder shared how urban, dual-income households are prioritising pet care over personal expenses. Arora linked the behaviour to a rising consumer category - DINKWAD (Double Income, No Kids, With A Dog). (Gemini AI/Representational image) In a LinkedIn post, Gagan Arora, founder of GoQuest, described visiting a “DINKWAD” (Double Income, No Kids, With A Dog) couple in Indiranagar, where both partners work in tech and have no children, but own a Golden Retriever. During his visit, Arora said that he noticed premium pet products across their home, from a ₹ 2,400 bag of dog food to probiotic supplements and grooming subscription boxes. The dog even had a dedicated fridge shelf with pre-portioned, labelled meals, he said. When asked about their monthly expenses, the couple estimated spending between ₹ 12,000 and ₹ 15,000 on their pet, covering food, grooming, vet visits, toys and treats, Arora wrote. “I asked what they spend on their own groceries. They laughed. Probably less,” he added.",[],https://www.hindustantimes.com/trending/bengaluru-couple-spends-rs-15-000-a-month-on-pet-dog-sparks-discussion-on-dinkwad-trend-101774442374827.html
Joseph Duggar arrest: Sister Jinger Duggar Vuolo and her husband break silence on ‘devastating news’,"Jinger Duggar Vuolo and her spouse, Jeremy Vuolo, have finally addressed the arrest of her brother, Joseph Duggar, for child molestation. Joseph Duggar arrest: Jinger Duggar Vuolo and Jeremy Vuolo express sorrow for the victim and concern over the impact of his actions, while also reflecting on their family's struggles with similar past accusations. (jingervuolo/Instagram) Joseph was taken into custody on March 18 and faced charges for lewd and lascivious conduct involving a victim under the age of 12, as well as lewd and lascivious behavior towards a victim aged 18 or older. The former reality television personality was also accused of molesting a 9-year-old girl in Florida in 2020, according to the Bay County Sheriff’s Office. Also Read: Joseph Duggar update: Jessa Duggar deletes post amid Kendra Duggar's arrest; ‘As a family…’ Joseph Duggar's sister speaks out after his arrest Speaking during Wednesday's episode of the couple's podcast, Jeremy called it a “devastating news,” emphasising that “it’s been a really difficult week” for the couple, Page Six reported. “It’s been one of those weeks that feels like years. And I did not think my heart could break like it has this week,” Jinger, who has been in matrimony with Jeremy since 2016, added. Opening up about the anguish and sorrow they have experienced regarding this situation, the former star of Counting On said that the way it's affected so many people is  “just unthinkable” and “so hard and painful on many levels."" Jerem",['https://www.hindustantimes.com/ht-img/img/2026/03/25/400x225/Duggar_1774453572291_1774453585787.jpg'],https://www.hindustantimes.com/world-news/us-news/joseph-duggar-arrest-sister-jinger-duggar-vuolo-and-her-husband-break-silence-on-devastating-news-101774451629559.html
