Headline,Content,Image,Url
"Imran Khan would rather die in prison than sell his principles: Kasim, Sulaiman narrate father’s defiant stance in jail","Former Pakistan skipper Imran Khan ’s health in jail has become a major talking point, with concern growing across the country and within the cricket community. Recently, several voices from the fraternity have urged the government to ensure proper medical care and humane treatment. Much of the anxiety stems from reports about his eyesight, prompting fresh calls for better attention to his condition while he remains in custody. Imran Khan’s sons reveal defiant stand from behind bars. (AP and Reuters) Imran remains one of Pakistan ’s most prominent figures, having famously guided the country to its 1992 World Cup triumph before entering politics and serving as the country's Prime Minister from 2018 until his removal in 2022. He has been in jail since 2023 following convictions in corruption-related cases. Since his arrest, Imran has been entangled in a series of legal battles and has consistently maintained that the cases against him are driven by political motives. Concerns around his well-being intensified earlier this year when he was taken to the hospital for treatment related to his eyes. Recently, former England captain Michael Atherton , in a column for The Times, shed fresh light on Imran Khan’s situation after speaking with his sons, Sulaiman Khan and Kasim Khan, sharing insights into what the former Pakistan skipper is currently going through in jail. Sulaiman offered an emotional glimpse into how the family has been coping, underlining his father’s resolve and reite",['https://www.hindustantimes.com/ht-img/img/2026/03/25/400x225/Imran_Khan_sons_1774438174127_1774438179831.jpg'],https://www.hindustantimes.com/cricket/imran-khan-would-rather-die-in-prison-than-sell-his-principles-kasim-sulaiman-narrate-father-s-defiant-stance-in-jail-101774437793440.html
Navratri 2026: Jai Madaan's easy tips to cleanse your aura and home,"During Navratri, beyond the prayers and rituals, these nine days offer a meaningful opportunity to cleanse not just your home, but also your mind and emotions. According to Dr Jai Madaan, Celebrity Spiritual Mentor, Entrepreneur, and India’s first Spiritual Style Icon, Navratri is the perfect time to remove negative energy and create a more balanced, peaceful environment, both within and around you. Navratri 2026: Jai Madaan's easy tips to cleanse your aura and home (Freepik) One of the easiest ways to begin this process is by decluttering your space. Your surroundings have a direct impact on how you feel, and even small messes can create a sense of heaviness without you realising it. When your home feels clean and organised, it naturally allows positive energy to flow more freely. ALSO READ: It's not about starving yourself, but about creating balance: Jai Madaan's fasting tips for Navratri 2026 Start by clearing out unnecessary items, especially from your entrance and living areas Keep your prayer space neat and dedicated Add fresh flowers and light diyas to uplift the atmosphere instantly Along with physical cleaning, traditional practices like burning natural incense can help purify the environment. Ingredients such as camphor, sage, or havan samagri are commonly used during Navratri. The gentle smoke and fragrance are believed to neutralise negativity and create a calm, soothing vibe. Many households also perform small havans or chant mantras to make the space feel more ",[],https://www.hindustantimes.com/astrology/exclusive-navratri-2026-jai-madaan-easy-tips-to-cleanse-your-aura-and-home-101774442131694.html
---,---,---,---
"Kolkata Knight Riders IPL 2026 Full Schedule: List of KKR fixtures with match dates, venues, and timings","Kolkata Knight Riders enter the IPL 2026 season looking to bounce back to their 2024 form, but it’s a season of big changes. No more Andre Russell for the Knights, which might denote the end of an era. But this is a squad mixed with experience and exciting youth, which sets them up for a season where they could cause big damage if they find their groove. Varun Chakravarthy and RInku Singh headline KKR's roster in 2026. (ANI Photo) With their fortress at the Eden Gardens, the team led by Ajinkya Rahane will know that strong home form will be essential to any sort of success this season. Although they start on the road, they have a hat-trick of matches on home turf to see out phase one of the season, and that might be enough to give them a winning start and set up the remainder of the season. The first assignment for KKR will be a visit to the Wankhede Stadium for a match against old enemies Mumbai Indians. It is a funny match in terms of what it could entail – in the history of the IPL, KKR have played against Mumbai at the Wankhede on 11 occasions, and won on just 2 occasions. Funnily enough, those two encounters – first in 2012 and then in 2024 – have been in seasons where Kolkata have gone on to win the tournament. Given MI’s horrible record in opening games – they haven’t won their first match since 2012 – this could be a beautiful omen for KKR fans. Following that, it’s back home to Kolkata and the Eden Gardens for a three-game homestand in the space of a week. First for ",['https://www.hindustantimes.com/ht-img/img/2026/03/12/400x225/ANI-20250507521-0_1746666928931_1773305175144.jpg'],https://www.hindustantimes.com/cricket/kolkata-knight-riders-ipl-2026-full-schedule-list-of-kkr-fixtures-with-match-dates-venues-and-timings-101773305087179.html
Who is Bose Krishnamachari? Kochi Biennale head resigns after sexual harassment complaint,"Bose Krishnamachari, a key figure behind India’s largest contemporary art festival, has stepped down as president of the Kochi Biennale Foundation following a sexual harassment complaint. The development comes months after Krishnamachari resigned in January, initially citing “personal and family reasons”. The Foundation has since confirmed that a sexual harassment complaint was among the factors behind his exit. Krishnamachari has stepped down both as president of the Foundation and as a member of its board of trustees. (LinkedIn/Bose Krishnamachari) Kochi Biennale Foundation chairperson Venu Vasudevan said that the Internal Complaints Committee (ICC) received a complaint against Krishnamachari in early January, with the alleged incident said to have taken place in the last week of December. On whether the ICC has completed its investigation in the case, Venu told news agency PTI that it is ""not in his purview to divulge information on that"". ""I cannot divulge what's happening with the committee, that's not in my purview. That's a statutory committee, it has to go through this. It is one of the reasons why he resigned,"" he said. Krishnamachari has stepped down both as president of the Foundation and as a member of its board of trustees. Who is Bose Krishnamachari? Bose Krishnamachari is best known as the co-founder of the Kochi-Muziris Biennale, India’s largest contemporary art festival. Along with artist Riyas Komu, he helped conceptualise and build the Biennale from scratch",['https://www.hindustantimes.com/ht-img/img/2026/03/25/400x225/bose_krishnamachari_1774437496195_1774437504138.jpg'],https://www.hindustantimes.com/trending/who-is-bose-krishnamachari-kochi-biennale-head-resigns-after-sexual-harassment-complaint-101774437407045.html
'I'd do a number on Kharg Island': Trump's 1988 warning to Iran resurfaces as US president pushes for ceasefire,"As US President Donald Trump moves towards a ceasefire with Iran after four weeks of fighting, an interview from 1988 has resurfaced, echoing the President's sentiments towards Tehran and how it ""must pay."" Amid this ceasefire push, an interview with the Guardian in 1988 and a $95,000 advertisement placed in leading American newspapers in 1987 have resurfaced. (AP) With the US-Israel war on Iran now in its fourth week, Washington is setting the stage for talks with Tehran. A 15-point peace plan has been sent by the US to Iran through Pakistan, which has offered to mediate in order to bring the ongoing conflict to an end. Amid this ceasefire push, an interview with The Guardian in 1988 and a $95,000 advertisement placed in leading American newspapers in 1987 have resurfaced. 'Stop paying to defend other countries': Inside Trump's advert A full-page advertisement placed by Trump in 1987, published in The New York Times, Washington Post and Boston Globe, called out US leaders for their handling of the Gulf crisis during the Iraq-Iran war. In the advert titled ""There's nothing wrong with America's Foreign Defence Policy that a little backbone can't cure"" - Trump wrote that the world was ""laughing"" at America as US Navy escorted tankers through the Strait of Hormuz. ""We're protecting ships we don't own, carrying oil we don't need, destined for allies who won't help,"" Trump wrote, specifically targeting Japan and Saudi Arabia. ""Make Japan, Saudi Arabia, and others pay for the prote","['https://images.hindustantimes.com/default/550x309.jpg', 'https://www.hindustantimes.com/ht-img/img/2026/03/25/400x225/AP03-25-2026-000005B-0_1774447501976_1774447511699.jpg']",https://www.hindustantimes.com/world-news/id-do-a-number-on-kharg-island-trumps-1988-warning-to-iran-resurfaces-as-us-president-pushes-for-ceasefire-101774443293494.html
---,---,---,---
---,---,---,---
---,---,---,---
"BJP releases third list of 19 candidates for Bengal, RG Kar victim's mother among contestants","The Bharatiya Janata Party released third list of candidates on Wednesday for the upcoming assembly polls in West Bengal. Among those fielded named in the third list is also the mother of the RG Kar medical college student who was raped and murdered. She has been fielded from Panihati constituency. The BJP named 19 candidates in its latest list for the assembly polls for 294 seats in West Bengal. (File Photo/HT) The BJP named 19 candidates in its latest list for the assembly polls for 294 seats in West Bengal. The polls in West Bengal will be conducted in two phases on April 23 and April 29 and the counting will be done on May 4. Also read: TMC asks ECI to remove Malda police observer, Bhabanipur RO over ‘BJP links’",['https://www.hindustantimes.com/ht-img/img/2026/03/25/400x225/The-Bharatiya-Janata-Party--BJP--will-hold--Samvid_1736881008762_1774452860059.jpg'],https://www.hindustantimes.com/india-news/bjp-releases-third-list-of-19-candidates-for-west-bengal-assembly-polls-rg-kar-victim-mother-among-contestants-panihati-101774451810764.html
---,---,---,---
"Aquarius Horoscope Today for March 25, 2026: Use inventive but simple methods to finish tasks","Aquarius (Jan 22-Feb 19) Daily Horoscope Prediction says, New Ideas Spark Change in Practical Ways Curiosity leads your choices today; friendly talks bring surprising support, useful offers appear, and small creative changes make daily life easier and more interesting now. Aquarius Horoscope Today: Read our expert astrological predictions to find out what the stars have in store for you. (Freepik) Aquarius energy favors fresh thinking and helpful people. Share your ideas clearly and accept small offers of assistance. Avoid big promises or impulse spending. Use inventive but simple methods to finish tasks. A neighbor or friend might bring good news; celebrate with loved ones tonight. Aquarius Love Horoscope Today Love today brightens when you speak openly and listen with care. If you have a partner, share a small joke or memory to bring smiles and calm. Singles may find friendship turning sweeter at a community event or class. Avoid testing each other with sharp comments; choose warmth. Honor family values and gentle rituals if they matter to your partner. Small gestures, like writing a kind note or offering help, will deepen your connection today. Aquarius Career Horoscope Today Work favors clever planning and teamwork. Share a clear plan with your team and ask for opinions to improve it. Small improvements to how you organize tasks will save time later. If a new idea seems risky, test it on a small scale first. Keep records and send short updates so others know progress. You",[],https://www.hindustantimes.com/astrology/horoscope/aquarius-horoscope-today-for-march-25-2026-use-inventive-but-simple-methods-to-finish-tasks-101774380874265.html
---,---,---,---
Dhurandhar 2 worldwide box office collection day 6: Ranveer Singh film soars past  ₹900 crore; surpasses Ranbir's Animal,"Dhurandhar 2 worldwide box office collection day 6: The weekdays after the opening weekend are the real test of longevity for any event film. Last year, Dhurandhar set the standard for sustained earnings after the initial buzz. With its exceptionally huge start, Dhurandhar The Revenge was not expected to emulate that. And yet, the Aditya Dhar film continues to defy expectations, norms, and traditionally held notions about the Bollywood box office. After a sensational first Monday, Dhurandhar 2 had a stellar Tuesday, sailing past the ₹ 900 crore mark globally. Dhurandhar 2 worldwide box office collection day 6: Rakesh Bedi in a still from the film. Dhurandhar 2 box office update Dhurandhar 2 released on Thursday in theatres, after a record-breaking premiere on Wednesday. The hundreds of paid previews helped the film open to a record ₹ 145 crore domestically and gross ₹ 240 crore worldwide. This helped the film amass ₹ 750 crore worldwide in its extended four-day opening weekend. After adding a neat ₹ 100 crore to that on Monday, the Ranveer Singh -starrer had another strong day on Tuesday, its sixth in theatres. As Dhurandhar 2 approached the end of its first week, it earned a staggering ₹ 56 crore net on Thursday domestically. This took its domestic collection so far to ₹ 575 crore net ( ₹ 687 crore gross). It is now galloping towards the ₹ 600-crore mark, which it should easily cross today (Wednesday), and even make a run for the ₹ 700-crore mark by Friday. Overseas, the fil",['https://www.hindustantimes.com/ht-img/img/2026/03/25/400x225/Dhurandhar_2_box_office_1774403804586_1774403804731.jpeg'],https://www.hindustantimes.com/entertainment/bollywood/dhurandhar-2-worldwide-box-office-collection-day-6-ranveer-singh-aditya-dhar-film-900-crore-beat-ranbir-kapoor-animal-101774403309115.html
Indian-origin teen who rejected  ₹2.8 crore offer to drop out of high school now runs his own AI startup,"An Indian-origin teenager in the US turned down a $300,000 (around ₹ 2.8 crore) offer to drop out of high school and instead continue building his AI startup aimed at helping farmers. Kunvar is the founder of Evion, a free AI-powered crop analysis tool that uses images captured by basic camera drones. (LinkedIn/Rudrojas Kunvar) According to a report by Business Insider, 16-year-old Rudrojas Kunvar, based in Germantown, Maryland, received the lucrative offer from a venture capitalist last year. “It was definitely a rough couple of weeks of contemplating. That’s a lot of money,” Kunvar said, recalling the decision. Kunvar is the founder of Evion, a free AI-powered crop analysis tool that uses images captured by basic camera drones. The system analyses the images to generate a crop health map, helping farmers identify which areas need water or fertiliser. ""Farmers can use that to predict the future of their crops,"" Kunvar said. ""You can see what areas need more water or fertilizer, rather than just spraying everywhere,” he explained. The 16-year-old said that the tool is designed to be a low-cost alternative to expensive agricultural drone services. Instead of relying on specialised equipment, farmers can use affordable drones, upload images and access insights via a dashboard. ""It's meant to be a more affordable plan for these low to mid-scale farms,"" he said. (Also Read: Indian-origin CEO reacts to co-founder flying 36 hours for marathon on weekend, returning straight to offic",['https://www.hindustantimes.com/ht-img/img/2026/03/25/400x225/Rudrojas_Kunvar_1774447523473_1774447529579.jpg'],https://www.hindustantimes.com/trending/us/indianorigin-teen-who-rejected-rs-2-8-crore-offer-to-drop-out-of-high-school-now-runs-his-own-ai-startup-101774447456659.html
"Paresh Raja’s £200,000 watch raised red flags years before £1.3-billion MFS collapse","Years before the dramatic collapse of UK mortgage lender Market Financial Solutions (MFS), a luxury watch worn by its founder Paresh Raja became an unlikely warning sign for a wary investor. Paresh Raja, the founder of MFS In 2019, Paresh Raja, the man behind MFS, turned up to meetings wearing a Richard Mille timepiece worth upwards of £200,000. For one potential investor, the display of wealth did not signal success, but rather raised questions. An expensive watch indeed According to the Financial Times report , Asif Godall, then co-chief investment officer at Cairn Capital, decided not to invest in MFS back in 2019 — in part because he was put off by Paresh Raja’s expensive Richard Mille timepiece. Godall recalled being struck by the ‘watch-to-house ratio’, noting that the Richard Mille watch was worth about half the value of his North London home. Here’s what the FT piece said: Paresh Raja, MFS’s director, sported a Richard Mille timepiece that can cost upwards of £200,000. A contact of Godall estimated the watch was about half the value of Raja’s north London home at the time. Godall decided to pass up on the opportunity to invest in MFS. (Also read: Remember Zuckerberg admiring Anant Ambani’s watch? His ₹ 7.7 crore timepiece explodes internet ) The collapse of MFS A UK-based mortgage lender, Market Financial Solutions (MFS), collapsed in late February amid serious allegations of fraud, triggering potential losses of up to £1.3 billion for major global lenders. Founded as",['https://www.hindustantimes.com/ht-img/img/2026/03/25/400x225/paresh_1774432596509_1774432604303.jpg'],https://www.hindustantimes.com/trending/paresh-raja-s-200-000-watch-raised-red-flags-years-before-1-3-billion-mfs-collapse-101774432263309.html
"MI told not to repeat Rohit Sharma mistake with Hardik Pandya: ‘Now SKY is hot topic, next year will be someone else’","Mumbai Indians boast a dressing room packed with leadership experience, with senior figures like Rohit Sharma and Suryakumar Yadav having guided India to major T20 success. A couple of seasons ago, the franchise made a bold call by handing the captaincy to Hardik Pandya , ending Rohit’s long and decorated stint that brought five IPL titles. The decision didn’t go down well with sections of the fanbase, especially with Hardik arriving from Gujarat Titans and immediately taking charge. Despite the noise, Mumbai Indians managed to reach the playoffs last season. However, expectations remain high, and the focus now is firmly on adding another trophy to their already impressive record. Mohammad Kaif advised Mumbai Indians to stick with Hardik Pandya as their skipper. (PTI) With Suryakumar fresh off leading India to a T20 World Cup win, talk has picked up around his leadership credentials. Some believe Mumbai Indians could consider a change at the top, with suggestions growing that he might take over from Hardik. Amid growing chatter, former India cricketer Mohammad Kaif urged the five-time champions to stay patient with Hardik, warning against repeating past mistakes and backing the all-rounder’s progress as a leader after guiding the side deep into the playoffs last season. ""I don't think that Mumbai Indians should make the same mistake again. They had a poor season after removing Rohit Sharma and bringing Hardik Pandya in. Hardik Pandya is settling in his role now. They played Q",['https://www.hindustantimes.com/ht-img/img/2026/03/25/400x225/Hardik_Pandya_Suryakumar_Yadav_1774441727781_1774441727926.jpg'],https://www.hindustantimes.com/cricket/mi-told-not-to-repeat-rohit-sharma-mistake-with-hardik-pandya-now-sky-is-hot-topic-next-year-will-be-someone-else-101774440747779.html
Callahan Pierce: 5 things about missing Massachusetts boy last seen near 236 Moraine Street in Plymouth County,"Massachusetts State Police are seeking public help in finding Callahan Pierce, a minor, who was last seen near Moraine Street in Marshfield, Plymouth County. Massachusetts State Police are seeking help in finding Callahan Pierce, a minor who went missing. (X/@Nerdy_Addict) Police said on social media “We greatly appreciate our community coming together as we always do in difficult times, however, we ask that no one come to the scene because it will impede our ability for our infrared cameras and any additional human scent will throw off our dogs. … We have lots of resources working on this,"" as per reports. Also Read | Samantha Pelrine, Daniel Forand: 5 things about Plymouth cop, husband accused of child sex abuse Here's all you need to know about Callahan Pierce, the missing child. Callahan Pierce: 5 things to know Pierce is 8 years old and was last seen near 236 Moraine Street in Plymouth County around 7pm. When he went missing on Tuesday night, Pierce was seen carrying a backpack. Pierce was wearing a black Marshfield sweatshirt with black sweatpants, as per authorities. Authorities have asked residents in the area to check camera footage and help cops zero in on Pierce's whereabouts. Anyone with information about Pierce's disappearance has been asked to contact the Marshfield Police Department immediately. Troopers assigned to the Air Wing, K-9 Unit, Troop D Community Action Team, and Field Services are supporting the search, state police said in a statement. Several peop",['https://www.hindustantimes.com/ht-img/img/2026/03/25/400x225/cpie_1774407901022_1774407905508.jpg'],https://www.hindustantimes.com/world-news/callahan-pierce-5-things-about-missing-massachusetts-boy-last-seen-near-236-moraine-street-in-plymouth-county-101774407034007.html
"Pisces Horoscope Today for March 25, 2026: Avoid rushing feelings or making big promises","Pisces (Feb 20-Mar 20) Daily Horoscope Prediction says, Soft Creativity Helps Solve Every Day Little Problems Your imagination guides practical choices today; kind conversations unlock new paths, small savings grow, and gentle self-care keeps your mood steady and bright this evening. Pisces Horoscope Today: Read our expert astrological predictions to find out what the stars have in store for you. (Freepik) Pisces should trust quiet intuition and help from friends. Use creative ideas to solve small problems and keep plans simple. Avoid lending large sums or making quick promises. At work, send a clear note to clarify tasks. Tonight, do a calming activity and rest well. Pisces Love Horoscope Today Love asks for gentle honesty and small kindnesses today. If you are with someone, share a simple plan for the day and give each other space to speak. Singles might notice someone sweet during a peaceful walk or in a class. Avoid rushing feelings or making big promises. Honor family customs if they are important. Pisces Career Horoscope Today At work, Pisces will benefit from quiet focus and creative thinking. Take time to list tasks and pick the most important one to finish first. Share a clear idea with someone you trust to get useful feedback. Avoid starting large projects without a simple plan. Keep communications short and kind to prevent misunderstandings. Pisces Money Horoscope Today Financially, Pisces should check monthly bills and avoid sudden purchases. Keep a small emergenc",[],https://www.hindustantimes.com/astrology/horoscope/pisces-horoscope-today-for-march-25-2026-avoid-rushing-feelings-or-making-big-promises-101774381057071.html
---,---,---,---
"Ajit Pawar crash wasn’t sabotage, says Devendra Fadnavis; rebuts Rohit Pawar","Maharashtra chief minister Devendra Fadnavis on Wednesday ruled out any foul play in the January 28 plane crash that killed deputy chief minister Ajit Pawar, stating that forensic and technical probes have found no evidence of sabotage, explosives, or pilot intoxication. Maharashtra chief minister Devendra Fadnavis at the Maharashtra assembly in Mumbai, on Mar 25, 2025. (Raju Shinde/HT Photo) Replying to a detailed debate in the state assembly, Fadnavis—who also heads the home department—addressed a series of allegations raised by Nationalist Congress Party (SP) MLA Rohit Pawar, who also filed a Zero FIR about the plane crash in Karnataka after his demand was rejected in Maharashtra. Fadnavis said Rohit Pawar was concerned about the case but an atmosphere must not be created that others are not bothered. “All of us want a proper probe into the incident. If there is foul play, we will find it out and won’t spare anyone,” he said. Fadnavis, however, underlined that the police in Congress-ruled Karnataka had no jurisdiction to file the FIR on Rohit’s complaint. “Only when a victim can’t go to the police station can a Zero FIR be filed. The Karnataka police had no right to file the FIR, he added. “An FIR is needed to set the law in motion. In this incident, an accidental death case (ADR) was registered. If negligence or foul play is established, a charge sheet is sent. If anyone is named in the ADR, the charge sheet is important,” he told the assembly. Responding to the many alle",['https://www.hindustantimes.com/ht-img/img/2026/03/25/400x225/Maharashtra-chief-minister-Devendra-Fadnavis-at-th_1774453406879.jpg'],https://www.hindustantimes.com/cities/mumbai-news/ajit-pawar-crash-wasn-t-sabotage-says-devendra-fadnavis-rebuts-rohit-pawar-101774453410209.html
